Concept;Question class;Question type;Question content;Answer;Alternative 1;Alternative 2;Alternative 3;Explanation;Difficulty rating (</= 20)
CPA Basics;Application;MC;What is a supplier {{NOT}} allowed to do when you're shopping?;Pressure you into buying something;Ask you if you need help;Show you products that are on sale;Help you pack your bags;When you're shopping, the supplier is not allowed to put unfair pressure on you to buy something, such as shouting at you, intimidating you or threatening to hurt you.;16
CPA Basics;Seed;MC;Who do you go to if you think a contract may be unfair?;The National Consumer Tribunal (NCT);The Equality Court;The magistrate's court;The Supreme Court;If you think a contract you have signed is unfair, unreasonable or unjust, you can go to the National Consumer Tribunal (NCT). ;10
CPA Basics;Retention;MC;What do suppliers have to do if their products are sold as damaged or unsafe?;Refund the consumer or repair or replace the products;Fine the consumer;Refuse to help the consumer;Make the consumer pay for half of the products;If products are damaged or unsafe, suppliers have to either refund the consumer or replace or repair the products. The supplier must pay for this and not the consumer.;8
CPA Basics;Retention;MC;How long do consumers generally have to return damaged or unsafe products?;6 months;1 year;3 years;1 week;Consumers should return damaged or unsafe products within 6 months to ask for a refund, replacement or repairs (which the supplier must pay for).;9
CPA Basics;Retention;MC;If you pay for a service, the CPA says that it should be________;Of a good quality and done on time;Of a bad quality and done late;Of an average quality;Of a bad quality and done very late;If a consumer pays for a service, they can expect the service to be of a good quality and done on time by the supplier.;8
CPA Basics;Retention;MC;Dangerous products (like chemicals) should be_______;Clearly labelled as dangerous;Banned;Wrapped in plastic;Unlabelled;If a product is dangerous, a supplier has to clearly label the product so consumers know it is dangerous. The supplier also has to tell the consumer how to use the product in a safe way.;8
CPA Basics;Application;MC;If you buy a TV and it's delivered broken, what can you do?;Ask the supplier for a new one;Ask the supplier for two new ones;Ask the supplier for free products;Ask the supplier for a loan;If any product you have bought is delivered broken or damaged in any way, you can ask the supplier for a refund, or to repair or replace the product. The supplier should pay for this, and not you.;15
CPA Basics;Application;T/F;Dangerous products should come with clear warning labels and instructions on how to use them.;TRUE;FALSE;;;Any dangerous or hazardous product (such as a toxic cleaning detergent) should have a clear warning on its label, as well as instructions on how to safely handle and use it.;15
CPA Basics;Seed;MC;What do we call an agreement where a supplier holds the goods you want, until you've paid them off?;A lay-by agreement;A mortgage;An instalment sale;A credit card;A lay-by agreement is when a consumer pays for something over a period of time and the supplier keeps the products until they've been paid for. The consumer normally needs to make a deposit.;3
CPA Basics;Retention;Y/N;According to the CPA, can you buy products or services using lay-by agreements?;Yes;No;;;According to the CPA, consumers can purchase products and services through lay-by agreements with suppliers.;8
CPA Basics;Retention;MC;Which of these could happen if a supplier can't give you the product you bought on lay-by?;You're given the same or better product;The supplier pays a fine;You pay a fine;The supplier is shut down;If you finish paying something off on lay-by but the supplier actually hasn't kept your product for you, the supplier can set things right by giving you the same or better product.;10
CPA Basics;Application;MC;What can you ask for if a shop hasn't kept the lay-by item that you've fully paid for?;A refund with interest;Free additional products;A discount on everything;A discount for your family;If a supplier doesn't give you the lay-by products after you have paid for them, you can ask for a refund with interest.;16