Concept;Question class;Question type;Question content;Answer;Alternative 1;Alternative 2;Alternative 3;Explanation;Difficulty rating (</= 20)
Contract basics;Seed;MC;What is a contract?;A binding agreement between two or more people;An agreement with one person;A slip from a shop;A special kind of credit;A contract is a legally-binding agreement between two or more people, companies or organisations. ;4
Contract basics;Retention;MC;What does {{legally binding}} mean?;Legal consequences for not obeying;When something is illegal;When something can't be enforced by the law;When something is illegal;If an agreement is legally-binding, you cannot break the agreement without facing some kind of consequence(s). ;9
Contract basics;Retention;MC;In contracts, what does {{party}} mean?;One of the sides entering into an agreement;A get together;A political organisation;A celebration;"In most contracts and/or legal agreements, ""parties"" is used to describe the different sides of the contract. If you're signing a contract, you are one of the ""parties"" to the contract.";12
Contract basics;Retention;MC;What happens if you don't follow the terms and conditions of a contract?;You breach the contract;You won't face penalties;There won't be any consequences;You can ask for another contract;When you don't obey the terms and conditions of a contract and don't honour your agreement, it's considered a breach of contract. When you breach a contract, you may face serious consequences.;10
Contract basics;Retention;MC;What can happen if you breach a contract?;You may face serious consequences;You won't face penalties;You can ask for another contract;Nothing happens;If you breach your contract, the other people (or organisation(s)) who have signed the contract with you can ask for compensation from you, such as money.;10
Contract basics;Application;T/F;If you enter into a contract, you are one of the parties to the agreement?;TRUE;FALSE;;;"In most contracts and/or legal agreements, ""parties"" is used to describe the different sides of the contract. If you're signing a contract, you are one of the ""parties"" to the contract.";17
Contract basics;Application;MC;Before entering into a contract, what must you do?;Read and fully understand the contract;Not listen to the contract ;Not honour the agreement;Ignore the contract and agreement;Ensure you read and fully understand your contact. This will help you understand all your obligations so that there's less chance of you breaching your contract. ;15
Contract basics;Seed;MC;Contracts can be:;Verbal or written;Only verbal;Only written;Only spoken;Contracts can be both verbal and written. Verbal contracts are spoken agreements between two or more people. Written contracts are easier to enforce than verbal ones.;5
Contract basics;Retention;MC;What is a verbal contract?;A spoken agreement between two or more people;A written agreement;A signed piece of paper;A signed contract;A verbal contract is a spoken agreement between two or more people. Verbal contracts are seen as slightly more informal than written ones, and a are harder to enforce.;8
Contract basics;Retention;T/F;Contracts always have to be written.;FALSE;TRUE;;;Contracts don't always have to be written. Sometimes contracts can be agreed to verbally, but written contracts give you more protection, especially in terms of the law.;8
Contract basics;Retention;Y/N;Can contracts sometimes be part verbal and part written?;Yes;No;;;Contracts can be part written and part verbal. For example, you might receive a written quote for a particular service and then agree to have the work done verbally, over the phone.;10
Contract basics;Retention;MC;Why is a written contract safer than a verbal one?;There is recorded proof of what was agreed;Contracts can only be written;Contracts can never be verbal;It is illegal to have a verbal contract;It is safer to have a written contract because everything that was agreed on is on record. If there is a disagreement or a question later on, there is proof of the agreement.;9
Contract basics;Application;MC;Which of the following will protect you more when agreeing to something?;A clear written contract;A verbal contract;A spoken contract;An unsigned written contract;A clear written contract will protect you when agreeing to something. Always ask for a written contract for important agreements such as credit, rental and insurance agreements.;16
Contract basics;Seed;MC-AOTA;Before signing a contract, you should:;All of the above;Make sure that you understand it properly;Make sure that you agree with all of it;Make sure that you can afford the costs or fees;Before signing and agreeing to a contract, make sure that you understand and agree with all the terms, and that you can afford the costs, fees and/or risks involved.;5
Contract basics;Retention;MC;What should you do if you don't understand something in a contract?;Ask for it to be explained;Just sign the contract;Ignore what you don't understand;Quickly sign the contract;If you don't understand something in a contract, it's up to you to make sure you find out what it means before you sign. If you still don't understand, don't sign.;9
Contract basics;Retention;MC;After signing a contract, you should ask for:;A copy of the contract;A loan;A discount;To break your contract;Once you sign a contract, ask for a copy of the contract to take away with you. This can be used to answer any questions you may have in the future.;10
Contract basics;Retention;MC;When signing a contract, you should:;Cross out or fill in any empty spaces;Not read the contract;Leave blank spaces open;Ignore parts of the contract;When signing a contract, you should fill in all places for names and dates, cross out empty spaces, and initial next to the markings. This prevents the contract being changed once you've signed it.;11
Contract basics;Retention;MC;When you make a change to a contract, what should you do?;Put your initials next to the changes;Not mark where you've made changes;Not fill in spaces for names;Not read the whole contract;When you make changes to a contract, always make sure you initial where you've made the change. This helps prove that you made and agreed to the changes yourself.;11
Contract basics;Application;MC;What should you do before signing a contract?;Read it carefully;Read it quickly;Read it and not concentrate;Read it and ignore parts;Always read a contract carefully before signing it. If you don't understand something, you can always ask for it to be explained to you before signing. ;15
NCA Basics;Seed;MC-AOTA;Which of the following is a credit provider?;All of the above;A bank;Certain shops like clothing shops;Micro lenders;Banks, certain shops like clothing shops and micro lenders are all examples of credit providers. Not all credit providers offer the same loans and not all credit providers are legal.;5
NCA Basics;Retention;Y/N;Can any company be a registered credit provider?;No;Yes;;;Companies can't just automatically become registered credit providers, they need to apply to become registered credit providers with the National Credit Regulator (NCR).;9
NCA Basics;Retention;MC;The regulatory body that ensures compliance with the National Credit Act is the __________;National Credit Regulator;Major credit providers;The credit bureau;SARS;The National Credit Regulator (NCR) is a body that regulates the credit providers, credit bureaus and other aspects of the credit market, in line with the National Credit Act.;9
NCA Basics;Application;MC;Why is it important for there to be a National Credit Regulator?;It ensures compliance with the NCA;It helps people break the law;It makes banking faster;It helps people pay tax;The National Credit Regulator (NCR) is important because it encourages all credit providers and consumers to obey the laws around credit in South Africa.;15
NCA Basics;Seed;MC;What is an affordability assessment?;A look at a person's finances and credit history;A written test;An hour-long exam;A look at only how many fines a person has;An affordability assessment is an analysis of a customer's income, expenditure and credit history (creditworthiness) in order to determine whether or not they will be able to pay back a loan.;5
NCA Basics;Retention;MC;Why is an affordability assessment done?;To make sure a person can pay back a loan;To make it more difficult for banks to work;To make credit confusing for people;To cost people money;An affordability assessment needs to be done to make sure a person can afford to pay back their loan. Credit providers should do these assessments before granting anyone credit.;9
NCA Basics;Retention;MC;Who carries out affordability assessments?;Credit providers;Customers;The NCR;Home Affairs;Credit providers should carry out affordability assessments when consumers apply for credit. Consumers need to make sure that they are honest about their financial information.;9
NCA Basics;Application;MC;If you apply for a loan, what should your credit provider do?;An affordability assessment;A criminal clearance check;A medical test;A language test;Before giving you a loan, your credit provider should make sure you can afford to pay it back by doing an affordability assessment. If one isn't done, you could be granted a loan you can't afford.;15
NCA Basics;Seed;T/F;Credit providers need to make sure customers can afford credit before approving it.;TRUE;FALSE;;;Credit providers need to make sure that consumers can afford any credit they have applied for before approving it. They can do this by conducting an affordability assessment. ;5
NCA Basics;Retention;MC;How do credit providers make sure that a consumer can afford credit?;By doing an affordability assessment;By guessing;By just asking the consumer;By only looking at the money in their wallet;Credit providers can check to see if a consumer can afford the credit they have applied for by doing affordability assessments. These are when a credit provider looks at a consumer's finances.;9
NCA Basics;Retention;MC;What is a credit agreement called if a credit provider doesn't do an affordability assessment?;A reckless credit agreement;A right credit agreement;A wrong credit agreement;A corrupted credit agreement;If a credit provider doesn't do an affordability assessment and grants someone credit, the credit agreement is called a reckless credit agreement.;10
NCA Basics;Retention;MC;A reckless credit agreement can result from a credit provider giving credit to:;A customer who they know can't afford it;Someone they believe can afford it;Someone who hasn't applied for credit;Someone who is a criminal;A credit agreement can become reckless when a credit provider has done an affordability assessment and knows someone can't afford credit, but still grants that person the credit.;10
NCA Basics;Retention;T/F;If a consumer doesn't understand the credit agreement, it can be called a reckless credit agreement.;TRUE;FALSE;;;If a consumer doesn't understand their rights and obligations, as well as the fees and costs of a credit agreement, it can be called a reckless credit agreement.;10
NCA Basics;Retention;MC;How can reckless credit agreements be dangerous for consumers?;They can lead to over-indebtedness;They can help them save money;They can help protect their rights;They can have less debt;Reckless credit agreements are dangerous for consumers because they can lead to over-indebtedness, as consumers can be given loans they can't afford.;12
NCA Basics;Application;MC;What can help prevent reckless credit agreements?;Affordability assessments;Language tests;Medical exams;A qualifications check;Affordability assessments can help prevent reckless credit agreements by ensuring a consumer can afford the credit they have applied for. Credit providers should conduct these before granting credit.;15
NCA Basics;Seed;MC;What does the National Credit Act (NCA) deal with?;Laws about consumer credit;Laws about savings;Laws about investments;Laws about tax;Reckless credit agreements are dangerous for consumers because they can lead to over-indebtedness, as consumers can be given loans they can't afford.;5
NCA Basics;Retention;MC;The NCA is a set of laws centred around:;Credit;Savings;Investments;Tax market;The National Credit Act (NCA) is a set of laws about credit in South Africa. These laws mainly affect consumers and credit providers.;8
NCA Basics;Retention;MC;Who is mainly affected by the NCA?;Consumers and credit providers;Tax consultants;Investment bankers;Tax and debt collectors;The National Credit Act (NCA) mainly affects consumers and credit providers (banks, micro lenders, certain stores like clothing or furniture stores, etc.).;9
NCA Basics;Retention;MC;It is important to know about the NCA as a consumer because:;It tells you your rights and responsibilities;It can make your banking faster;It can help make you more investments;It will help you with your tax;It's important to know about the NCA because its laws are meant to help consumers and credit providers understand their rights and responsibilities.;12
NCA Basics;Application;MC;If you want to apply for credit, which set of laws could help you understand your rights?;The NCA;The NCB;The NCT;The NCC;The laws in the NCA can help protect and guide you when using a credit provider. The NCA helps consumers know what their rights and responsibilities are when applying for and using credit.;15
NCA Basics;Seed;MC;How does the NCA protect consumers?;It promotes responsible lending;It stops credit providers from working;It lets customers stop paying;It allows credit providers to be dishonest;The NCA protects consumers by giving consumers protected rights. Credit providers need to acknowledge these rights when offering credit services.;5
NCA Basics;Retention;MC-AOTA;What are some of the protected consumer rights in the NCA?;All of the above;Right to apply for credit;Right to be protected against discrimination;Right to have a credit agreement in plain language;Consumers have the right to apply for credit, the right to be protected against discrimination when applying for credit and the right to have a credit agreement in plain language.;9
NCA Basics;Application;T/F;It's important to know your rights and responsibilities as per the National Credit Act.;TRUE;FALSE;;;As a credit consumer (customer), you have certain rights that protect you against unfair treatment. But you also have responsibilities. It's important to understand both.;12
NCA Basics;Seed;MC;According to the NCA, you have the right to:;Apply for credit;Apply for shares;Apply for tax;Apply for savings;All consumers have the right to {{apply}} for credit, regardless of age, race, religion or economic standing, but the NCA doesn't give all consumers the right to be {{granted}} credit.;5
NCA Basics;Retention;T/F;If you want to apply for credit, you have the right to do so.;TRUE;FALSE;;;If you would like to apply for credit at a credit provider, you have the right to. You can be denied that credit though if an affordability assessment shows you can't afford the loan.;8
NCA Basics;Retention;MC-AOTA;Credit providers are NOT allowed to:;All of the above;Only grant credit to friends;Only grant credit to people from a certain area;Unfairly discriminate against you;Credit providers are not allowed to unfairly discriminate when granting credit. They aren't allowed to only grant credit to people of certain races, religions or areas.;9
NCA Basics;Application;MC-AOTA;Because of your protected rights in the NCA, you have the right to:;All of the above;Apply for a loan;Apply for a credit card;Apply for vehicle financing;You have the right to apply for any kind of credit, this includes loans, credit cards, vehicle financing and home loans.;15
NCA Basics;Application;MC;Your credit provider isn't allowed to refuse you credit based on:;Your race;Your financial history;Your amount of debt;Your current loan repayments;Your credit provider is not allowed to refuse you credit simply because of your race. You have the right to be protected from discrimination when applying for credit.;16
NCA Basics;Seed;MC;If you are not granted credit, you have the right to:;Be told the reason why;Nothing;To steal from the credit provider;Not ask nor be told the reason;If your credit application is declined, you can ask the credit provider why. According to the NCA, you have the right to be told the reason.;5
NCA Basics;Retention;Y/N;If you aren't given a loan, you can ask your bank for the reason and expect to be told.;Yes;No;;;If you aren't granted a loan by your bank, you have the right to be given a reason why your application wasn't successful, if you ask your bank for one.;8
NCA Basics;Application;MC;If you aren't granted a credit card by your bank, you can:;Ask your bank for the reason why;Be fined by your bank;Ask your bank for the reason and not get an answer;Ask your bank for the reason and be ignored;If you aren't granted a credit card by your bank, you can ask your bank for the reason they decided not to grant you credit and you expect an answer.;15
NCA Basics;Seed;MC;What is one of your protected rights in the NCA?;To have a credit agreement in plain language;To have no credit agreement;To have a complicated credit agreement;To have a confusing credit agreement;One of your protected rights in the NCA, is to have a credit agreement that is in plain language. This means that you can easily understand the agreement.;6
NCA Basics;Retention;MC;If a credit agreement is in plain language it is meant to be:;Easier to understand;Difficult to understand;Very confusing;Difficult to read;When a credit agreement is in plain language, it is easier to understand and uses relatively simple wording. Plain language is not overly complicated or filled with jargon.;9
NCA Basics;Retention;MC;Why is it important for a credit agreement to be in plain language?;It helps you know what you're agreeing to;It makes it harder for you to understand;It confuses you;It makes the credit market less transparent;It is important for a credit agreement to be in plain language because it means you can understand what you are agreeing to when you sign it.;11
NCA Basics;Application;MC;Before signing a credit agreement, you should always make sure that:;You understand all of it properly;You understand some of it;You understand most of it;You don't understand it;When signing a credit agreement, make sure that you understand all of it properly. The language of a credit agreement should be plain and easy to understand.;15
NCA Basics;Seed;T/F;One of your protected rights in the NCA, is the right to a free copy of your credit agreement.;TRUE;FALSE;;;One of your protected rights in the NCA is to receive a free copy of your credit agreement from your credit provider once you've signed it.;5
NCA Basics;Retention;MC;If you sign a credit agreement with a credit provider you are entitled to:;A free copy of your credit agreement;No copy of your credit agreement;Half a copy of your credit agreement;Pay for your copy of the credit agreement;If you sign a credit agreement with a credit provider, you are entitled to a free copy of your credit agreement.;8
NCA Basics;Retention;MC-AOTA;Why is it important to get a free copy of your credit agreement?;All of the above;You can look at it if you have a query about fees;You can use it to see when the loan will be repaid;You can ensure you know the payment requirements;You can use a free copy of your credit agreement to answer any questions about the fees, to see when your loan must be repaid and to ensure you know all the loan requirements.;13
NCA Basics;Application;MC;What should you do with your copy of a credit agreement?;Keep it in a safe place;Pay for it;Shred it;Give it to a stranger;If you sign a credit agreement, make sure you receive a copy of it and then keep it in a safe place. If the agreement is digital, make sure you always have access to it.;15
NCA Basics;Seed;MC;When applying for credit, one of your protected rights is:;For your financial info to be private;To be discriminated against;To not be given a credit agreement;To have to pay for a copy of the credit agreement;When applying for credit, the NCA states that one of your protected rights is for your financial information to remain confidential.;5
NCA Basics;Retention;T/F;According to the NCA, a credit provider has to do an affordability assessment before giving credit.;TRUE;FALSE;;;The National Credit Regulator (NCR), informed by the laws of the National Credit Act (NCA) requires registered credit providers to carry out affordability assessments on their applicants.;8
NCA Basics;Retention;MC;What do you have to do as a consumer when applying for credit?;Be honest about all financial info;Lie about financial obligations;Lie about debt;Be dishonest about income;When applying for credit, you as the consumer have the obligation to tell your credit provider about all of your financial commitments.;9
NCA Basics;Retention;MC;What is your credit provider NOT allowed to do when doing an affordability assessment?;Tell everyone about your finances;Look at your debt;Look at your payslips;Look at your income;A credit provider is not allowed to tell people about your finances. They aren't allowed to share the financial information you give them, unless under specific conditions.;11
NCA Basics;Application;MC-AOTA;You give a clothing store your payslips when opening an account. The clothing store can't:;All of the above;Share that information with the community;Share that information with strangers;Share that information with customers;You have the protected right to have your financial information treated as confidential. Credit providers can't share it with others, unless under specific conditions.;16
NCA Basics;Seed;MC;Before signing a credit agreement, it's up to you to make sure that you _____________;Understand all the details;Have free speech;Are dressed well;Discriminate against the credit provider;Along with your rights, you also have obligations when it comes to credit agreements. One of those is to make sure you understand all the details before you sign.;5
NCA Basics;Retention;Y/N;Should you double-check that you understand all the details before signing a credit agreement?;Yes;No;;;Before signing a credit agreement, make sure that you understand all that is expected of both you and the credit provider, including your rights and responsibilities.;9
NCA Basics;Retention;MC;If you don't understand something in a credit agreement, you should:;Ask about it {{before}} signing;Guess what it means;Ignore it;Ask about it {{after}} signing;If you don't understand something in a credit agreement, you should ask for it to be explained. Don't sign a credit agreement if there's anything you don't understand.;10
NCA Basics;Application;MC;Signing something you don't understand is dangerous because:;There could be costs you haven't planned for;You could save money;You could make good investments;You might go to jail;Failing to understand your credit agreement is dangerous because you could be liable for costs that you weren't planning for. When you understand everything, there are no surprises.;16
NCA Basics;Seed;MC;What is a credit limit?;The maximum amount of credit you can use;The minimum amount of credit a person can use;A type of personal loan;A savings account;A credit limit is the maximum amount of credit that a given credit provider makes available to a customer. Your credit limit is usually linked to your affordability and credit history.;4
NCA Basics;Retention;MC;If you have a credit card, the credit limit is the______;Maximum you can spend on that card;You can spend as much as you want on that card;You don't have to pay back your loans;You can't use any credit;If you have a credit card with a credit limit, it means you can only spend that amount on that card, i.e. if your credit limit is R5000, you can only spend R5000 with that card.;8
NCA Basics;Retention;T/F;One of your protected rights is to refuse when a credit provider wants to increase your credit limit.;TRUE;FALSE;;;The NCA states that you can decline to have your credit limit increased by your credit provider, if you are not comfortable with that increase.;9
NCA Basics;Application;MC-AOTA;Why is it important to be able to refuse increases to your credit limit?;All of the above;It can help prevent over-indebtedness;It keeps you in control of your finances;It helps to keep your debt manageable;It is important to be able to decline increases to a credit limit because it means that you only use the credit you are comfortable with and that you know you can repay.;16
NCA Basics;Seed;T/F;Over-indebtedness is when you can't afford to meet all of your financial commitments.;TRUE;FALSE;;;Over-indebtedness is a financial situation where a person consistently can't afford to pay their debts. This can lead to that person sinking even deeper into debt as time goes by.;4
NCA Basics;Retention;MC-AOTA;What can cause over-indebtedness?;All of the above;Overstating your income;Spending recklessly;Lying about your expenses;There are many causes of over-indebtedness, such as lying about how much you earn and how high your expenses are when you fill in an application.;9
NCA Basics;Application;MC;You want to take out a loan. Your credit provider must do__________;An affordability assessment;A language test;A police clearance test;An internal audit;If you're going to take out a loan, your credit provider should do an affordability assessment to make sure that you can afford the loan.;15
NCA Basics;Seed;MC;What is debt review?;A legal way to help with over-indebtedness;A way to create more debt;A way to get more savings;A way to get more loans;Debt review is a legal way for consumers to get help if they are struggling with over-indebtedness.;4
