Concept;Question class;Question type;Question content;Answer;Alternative 1;Alternative 2;Alternative 3;Explanation;Difficulty rating (</= 20)
NCA Basics;Retention;MC;Which of these happens during debt review?;A consumer is officially declared over-indebted;A consumer's debts are paid off;A consumer is given more loans;A consumer is fined;During debt review, a consumer is officially declared as over-indebted and a debt counsellor helps them manage their finances.;8
NCA Basics;Retention;T/F;Anyone can be a debt counsellor.;FALSE;TRUE;;;Not just anyone can be a debt counsellor. Debt counsellors in South Africa need to be registered with the NCR.;9
NCA Basics;Retention;MC;What do debt counsellors typically do for a consumer?;Create a new repayment plan;Pay off all their debt;Fine the consumer;Give the consumer a loan;A debt counsellor will create a new repayment schedule for the consumer. They will then have to speak to the credit provider and see if the credit provider agrees with the new repayment plan.;9
NCA Basics;Retention;MC;In order to make a new payment plan valid, a debt counsellor has to________;Get a court order;Pay the consumer;Fine the consumer;Give the consumer a loan;Once a new repayment schedule has been created, the debt counsellor will need to get a court order that will confirm the new schedule.;9
NCA Basics;Retention;T/F;Credit providers need to agree to a new repayment plan before it can go ahead.;TRUE;FALSE;;;The debt counsellor needs to speak to the credit provider to see if they agree with the new repayment schedule.;9
NCA Basics;Retention;MC;In debt review, what happens if the credit provider doesn't agree with the new repayment plan?;The matter goes to the magistrate's court;The consumer will just have to pay;The debt counsellor will be fined;The credit provider will cancel the repayments;If the credit provider doesn't agree with the new repayment schedule, the matter will have to go to the magistrate's court.;9
NCA Basics;Retention;MC;If you are under debt review, you can't:;Get credit;Make payments;Save money;Use your debit card;If you are under debt review, you can't apply for credit at or be granted credit by legal, registered credit providers.;10
NCA Basics;Application;MC;If you are struggling with over-indebtedness, you could see a ___________;Debt counsellor;Mashonisa;Debt helper;SARS;According to the NCA, if you are struggling with debt, you can see a debt counsellor. Debt counsellors can help you manage your finances and find a way to make your repayments more manageable.;15
NCA Basics;Seed;T/F;A reckless credit agreement is when an affordability assessment isn't done before credit is given.;TRUE;FALSE;;;A reckless credit agreement is when a credit provider doesn't do an affordability assessment before granting credit to a consumer.;5
NCA Basics;Retention;MC;When a credit provider knowingly gives credit to a consumer who can't afford it, it is called,;A reckless credit agreement;A bad credit agreement;A corrupted credit agreement;A cooked credit agreement;If a credit provider does an affordability assessment, but ignores the results and gives credit to a consumer who can't afford it, the credit agreement is considered reckless.;9
NCA Basics;Retention;MC-AOTA;How does the NCA aim to protect consumers from reckless credit agreements?;All of the above;By requiring affordability assessments to be done;By penalising reckless lending;By encouraging plain language agreements;The NCA aims to protect credit customers by making credit providers do affordability assessments, which in turn can help to prevent customers from becoming over-indebted.;11
NCA Basics;Retention;MC;What happens if a credit agreement is found to be reckless?;The agreement can be suspended or set aside;The consumer is fined;The debt counsellor is fined;The credit agreement is followed as it is;If any credit agreement is found to be reckless, the credit agreement can be suspended or altered in a way that the consumer's obligations no longer apply.;9
NCA Basics;Application;MC;Who decides if a credit agreement is reckless?;A tribunal;The consumer;The debt counsellor;The credit provider;Only a court tribunal can decide if a credit agreement is reckless or not. Neither the consumer nor the credit provider can make this decision themselves.;17
CPA Basics;Seed;MC-AOTA;The Consumer Protection Act (CPA) aims to encourage:;All of the above;Fair consumer-supplier relationships;Open consumer-supplier relationships;Good business practices;The Consumer Protection Act (CPA) aims to encourage fair and open relationships between consumers and suppliers, as well as good business practices for suppliers.;5
CPA Basics;Retention;MC;Who is mainly affected by the Consumer Protection Act (CPA)?;Consumers and suppliers;Credit providers and consumers;Bankers and banks;Consumers and tax officials;The Consumer Protection Act (CPA) mainly affects consumers and suppliers. Both suppliers and consumers need to acknowledge these laws when interacting with one another.;8
CPA Basics;Retention;MC;According to the Consumer Protection Act what is a supplier?;A business that markets goods or services;A business that uses products or services;A person who uses products or services;A bank;A supplier is a business or any other organisation/company that supplies products or services to others and charges for these products or services.;9
CPA Basics;Application;MC;What set of laws can apply to you when shopping?;The CPA;The CPC;The CPT;The CBB;The Consumer Protection Act (CPA) is a set of laws that protects consumers when using suppliers. The laws in the CPA need to be acknowledged by both consumers and suppliers.;15
CPA Basics;Application;MC;The CPA aims to protect consumers from:;Abuse and dishonesty from suppliers;Paying for purchases;Being responsible when buying things;Shopping and spending all their money;The Consumer Protection Act (CPA) protects consumers from potential abuse or dishonesty from suppliers. The CPA also allows consumers to know what their rights and responsibilities are when shopping.;17
CPA Basics;Seed;MC;The set of laws that establishes norms and standards regarding consumer protection is _____;The CPA;The NCA;The ACP;The ANC;The Consumer Protection Act (CPA) aims to encourage fair and open relationships between consumers and suppliers, as well as good business practices for suppliers.;5
CPA Basics;Retention;Y/N;Are suppliers allowed to ignore consumers' rights?;No;Yes;;;Suppliers can't ignore the rights given to consumers by the Consumer Protection Act. They have to acknowledge them and uphold these laws when interacting with consumers.;9
CPA Basics;Application;T/F;Knowing your consumer rights can help you avoid being taken advantage of.;TRUE;FALSE;;;It is important to know your rights and responsibilities outlined in the Consumer Protection Act in order to know what's expected of you and the businesses you buy from.;12
CPA Basics;Application;T/F;You as the consumer have no rights when purchasing products or using services.;FALSE;TRUE;;;You as the consumer have consumer rights given to you by the Consumer Protection Act (CPA) when purchasing products or when making use of services.;15
CPA Basics;Seed;MC-AOTA;According to the CPA, what can't a supplier do?;All of the above;Refuse to sell to someone based on gender;Refuse to sell to someone due to race;Refuse to sell to someone due to language;According to the CPA, suppliers can't unfairly discriminate against consumers based on gender, sex, race, language, religion, disability, sexual orientation, marital status or for any other u reason.;6
CPA Basics;Retention;MC;If you think a supplier is being discriminatory, you have the right to:;File a complaint;Not pay for products;Break things in the shop;Be reckless with products;If you feel that a supplier is being discriminatory, you have the right to file a complaint against that supplier with the National Consumer Commission.;11
CPA Basics;Retention;MC;The National Consumer Commission can help you if:;You feel a supplier is being discriminatory;You can't pay back a loan;You have a lot of debt;You need to get a credit card;The Equality Court or the National Consumer Commission can help you if you think a supplier is unfairly discriminating against consumers.;12
CPA Basics;Application;MC;A supplier tells you they won't sell to you because of your race. This is:;Unfair discrimination;Fair discrimination;Allowed by the law;Allowed by the CPA;A supplier can't refuse to sell products or supply services to you based on your place of birth. This is unfair discrimination.;16
CPA Basics;Seed;MC;What is direct marketing?;When a supplier advertises to you directly;A form of supplier;A form of debt;A form of online business;Direct marketing is a form of advertising, where businesses directly reach out to consumers through emails, SMSs, mail or phone calls, in order to sell products and services.;3
CPA Basics;Retention;MC-AOTA;Direct marketing is done through:;All of the above;Marketing emails;Marketing SMSs;Marketing flyers;Direct marketing is done through marketing emails, SMSs, flyers, phone calls and traditional mail (the post).;11
CPA Basics;Retention;MC;If you don't want to get direct marketing, you can choose to:;Opt out of direct marketing messages;Not pay your bills;Not answer your emails;Not empty your post box;You have the right to tell suppliers (like shops, stores and service providers) that you don't want to receive directing marketing from them. Suppliers then have to respect your wishes.;10
CPA Basics;Retention;Y/N;You can choose whether or not you want to receive direct marketing.;Yes;No;;;According to the Consumer Protection Act (CPA) you can choose how you'd like to get direct marketing (if you want to get it at all) - for example, through email, SMS or over the phone.;10
CPA Basics;Application;MC;What can you do if you don't want to get direct marketing SMSs anymore?;You can opt out;Continue to get them because you can't opt out;Take the supplier to the Equality Court;Go to the magistrate's court;If you don't want to get any more direct marketing SMSs, you should be able to opt out if them. Usually this is done by sending an opt out message to the supplier in question.;15
CPA Basics;Seed;MC;One of your rights in the CPA, is your right to_____;Choose a supplier yourself;Demand lower prices from suppliers;Damage products without paying for them;Make up lies about a supplier;According to the Consumer Protection Act, you have the right to choose where you buy things from - or in other words, the right to choose the supplier you want to use.;6
CPA Basics;Retention;MC;If you're not comfortable with a supplier's agreement, you can ___________;Say no and find another supplier;Ask not to pay for products or services;Be dishonest when agreeing to things;Ask for a discount;If you are not comfortable with a proposed agreement with a supplier, you have the right to say no and then choose another supplier you are comfortable with.;13
CPA Basics;Application;MC;What should you do if you no longer want to shop at a certain grocery store?;Go to another one;Ask your current grocery store for a discount;Ask your current grocery store for a loan;Refuse to pay for your groceries;If you no longer want to shop at a certain store, you have the right to choose to use another store.;15
CPA Basics;Seed;MC;What is a fixed-term agreement?;A contract that lasts for a certain time;A contract that lasts forever;A contract that can never be cancelled;A contract that will never end;A fixed-term agreement is a contract that lasts for a certain length of time, such as 12 months or 24 months.;5
CPA Basics;Retention;MC;A fixed-term agreement should have:;A start and end date;No dates;No end date;No start date;A fixed-term agreement needs to have a clear start and end date. Fixed-term agreements can't be open-ended in terms of how long they last.;9
CPA Basics;Retention;MC;What is the recommended maximum duration of a fixed-term agreement?;24 months;100 years;Forever;It can end whenever you want;According to the CPA, fixed term-agreements should only last for a maximum of 24 months. You can, however, agree to a longer fixed-term agreement if you want to.;9
CPA Basics;Retention;MC;Aa a consumer, you have the right to:;Cancel a fixed-term agreement;Never pay bills;Never be able to cancel a fixed-term agreement;Be forced into additional agreements;According to the CPA and the right to choose, consumers have the right to cancel or renew fixed-term agreements.;9
CPA Basics;Retention;MC;In fixed-term agreements, what is a cancellation penalty?;Money paid for ending the agreement early;A special kind of contract;A type of credit;A law in the CPA;A penalty is an amount of money that needs to be paid as a fine. If a consumer cancels a fixed-term agreement before it ends, they may have to pay a penalty.;9
CPA Basics;Retention;MC;If you cancel a fixed-term agreement that hasn't ended yet, what might you have to do?;Pay a reasonable penalty; Community service;Go directly to jail;Pay extra tax;If you cancel a fixed-term agreement before it ends, you can be charged a reasonable penalty by the supplier. This kind of penalty is common when a fixed-term lease is cancelled early.;10
CPA Basics;Retention;MC;If you want to cancel a fixed-term agreement, how many days' notice do you need to give?;20 business days;5 business days;0 business days;100 business days;If you want to cancel a fixed-term agreement before it ends, you need to give the supplier 20 business days' notice. Even if you do this, you can still be charged a reasonable penalty.;9
CPA Basics;Application;Y/N;Your cellphone contract has come to an end and you don't want to renew it. Should you be charged a penalty?;No;Yes;;;Some fixed-term agreements automatically get renewed when they come to the end of the initial term. But if you want to cancel it permanently once it ends, you shouldn't be charged a penalty.;15
CPA Basics;Application;MC;You want to cancel your internet contract before it ends. What can your supplier do?;Charge you a penalty;Never let you cancel;Not cancel the agreement;Take your TV;If you want to cancel your internet contract before it ends, your supplier can charge you a reasonable penalty.;15
CPA Basics;Seed;Y/N;If you want repairs or a maintenance service done, can you ask a supplier for a quote?;Yes;No;;;A consumer is allowed to ask a supplier for a written quote before they make a decision on whether or not they want to use the supplier or have a service or repairs done.;4
CPA Basics;Retention;MC;What is a supplier NOT allowed to do?;Make a consumer pay for a quote;Give a consumer a quote;Give a consumer a written quote;Email a consumer a quote;A supplier is not allowed to make a consumer pay for a quote if they ask for one.;8
CPA Basics;Retention;MC;Once a consumer is given a quote for repairs or a service, they can:;Decide not to do the repairs or service;Have the service done and not pay;Have the repairs done and not pay;Have the service or repairs done and not pay;Once a consumer is given a quote, they can decide whether or not they would like to have the repairs or service done. They are allowed to decide not to have anything done.;8
CPA Basics;Retention;T/F;A supplier should get your permission in writing before actually doing any maintenance/repair work?;TRUE;FALSE;;;A supplier has to tell a consumer before doing repairs or a service. They can't do the repairs/service and then charge for it, if they did not notify the consumer about the repairs/service.;8
CPA Basics;Retention;MC;What does a consumer have to do before a supplier does repairs or a service?;Authorise the repairs or service;Disagree with the repairs or service;Not ask for a quote;Not plan on paying the supplier;The consumer needs to be told before a supplier does repairs or a service and the consumer needs to agree that the repairs or service can and should be done.;8
CPA Basics;Application;Y/N;Would a builder need to let you know before doing any repairs on your house?;Yes;No;;;Any supplier, such as a builder, needs to let you know before they do any repairs or a service. If they don't notify you, you can't be charged.;16
CPA Basics;Seed;T/F;You can refuse to buy display products or products that have already been opened.;TRUE;FALSE;;;"As a consumer you have the right to refuse to buy products that have been on a display table, a mannequin or something similar that takes away from the products ""newness"".";5
CPA Basics;Retention;MC;If you're given a product that's been opened you can insist on it being replaced with:;An unopened one;A more expensive version;A completely different product;Steal the product;If a supplier (like a store or manufacturer) gives you a product that has already been opened, you're within your rights to reject that product and ask for an unopened one.;8
CPA Basics;Retention;T/F;You have the right to inspect goods first, before you accept delivery.;TRUE;FALSE;;;If products are delivered to you, you have the right to be able to look at them to make sure they aren't damaged or defective, before you sign for them.;8
CPA Basics;Retention;MC;What can you do if the goods you buy turn out to be already damaged?;Return them and ask for a refund;Fine the supplier;Lie about what was bought;Be charged extra by the supplier;If you buy products that are damaged, you have the right to return them to the supplier and ask for a refund, as long as you weren't the one who damaged them, within a reasonable period of time.;8
CPA Basics;Retention;Y/N;Should suppliers allow consumers time to examine bought or delivered products.;Yes;No;;;Suppliers should give their consumers the opportunity to examine delivered products to make sure they aren't damaged, defective or of a bad quality.;9
CPA Basics;Retention;MC;If you receive a delivery and the products are defective, you can:;Return them;Lie about what was delivered;Ask the supplier for free products;Be charged extra by the supplier;If a consumer has something delivered and it is of a bad quality, defective or damaged, the consumer can return it to the supplier and ask for a refund, within a reasonable period of time.;8
CPA Basics;Retention;MC-F;You can be made to pay for products you weren't going to buy if you_____;Deliberately damage the products;Litter inside the shop;Look interested in the products;All of the above;A supplier can charge consumers for loss or damage of property if they purposefully damages things, or damage things by acting recklessly.;9
CPA Basics;Application;MC;What should you do if you buy a shirt and it has a hole in it?;Return it to the supplier;Ask for three free shirts;Ask for a discount on all clothes;Steal something later from the supplier;If you buy a shirt, or any product, that is damaged or in any way defective, you can return it to the supplier and ask for a refund (this needs to be done in a reasonable period of time).;16
CPA Basics;Seed;T/F;You have the right to receive an agreement in plain language.;TRUE;FALSE;;;You have the right to ask for contracts or agreements to be in plain language, or in other words, a writing style that is relatively easy to understand.;6
CPA Basics;Retention;MC;Suppliers (including shops) have to _____________;Clearly show the prices of products;Hide the prices of products;Block the prices of products;Not tell consumers the prices of products;Suppliers have to clearly show the prices of products in a place where consumers can see them. They can't try to hide or obscure prices.;8
CPA Basics;Retention;MC;What do suppliers have to do when advertising a sale or promotion?;Clearly show the start and end date;Give you a special discount;Hide the start date;Hide the end date;Suppliers have to clearly show the start and end dates of sales or promotions in promotional materials, such as flyers of brochures.;8
CPA Basics;Retention;MC;If a product has two different advertised prices, a consumer can ask to:;Pay the lower of the two prices;Have the product for free;Pay for one and get another one for free;Pay half of the displayed price;If a product has two prices displayed for it, a consumer can ask to pay the lower of the two prices for the product. The supplier can't charge the consumer the higher of the two prices.;8
CPA Basics;Retention;Y/N;Can consumers ask suppliers for receipts or invoices?;Yes;No;;;Consumers can ask suppliers for a receipt or invoice after making a purchase. They don't have to pay for the receipt or invoice.;9
CPA Basics;Retention;MC-AOTA;Which of these should a receipt or invoice have on it?;All of the above;Name, description and price of the good(s);Date of purchase;Supplier's name and address;A receipt or invoice needs to include the name, description and price of the good/s, including any tax, as well the date of the purchase and the supplier's name, address and contact information.;9
CPA Basics;Application;MC;What can you do if a TV has two different prices displayed for it?;Ask to pay the lower of the two prices;Ask for the TV for free;Ask to pay half the price;Ask to buy one TV and get another for free;If two prices are displayed for a product, like a TV, you can ask to pay the lower of the two prices. The supplier can't tell you to pay the higher of the two prices.;15
CPA Basics;Application;Y/N;If you buy something from a shop, you can ask for a receipt.;Yes;No;;;You have the right to ask for a receipt or invoice after you have made a purchase. The receipt or invoice needs to have certain information on it like the name, description and price of the purchase.;15
CPA Basics;Application;MC;Amongst other things, what should a brochure for a grocery store sale show?;The start and end date of the sale;A picture of the shop owner;A bright heading;The shop's name in large letters;According to the Consumer Protection Act, a brochure, flyer or any other form of advertisement for a promotion/sale needs to clearly show the start and end date of the sale.;15
CPA Basics;Seed;MC;What can a supplier NOT do when advertising their products or services?;Purposefully use the wrong information;Use brochures or flyers;Advertise their address;Use bright colours;Suppliers aren't allowed to purposefully use the wrong information about products or services when advertising their business.;5
CPA Basics;Retention;Y/N;Are suppliers allowed to lie about the price of a product?;No;Yes;;;A supplier can't lie about the price of products, even if they are doing it to try to promote their product.;9
CPA Basics;Retention;T/F;A supplier can be dishonest about the benefits of a product.;FALSE;TRUE;;;A supplier isn't allowed to be dishonest about the benefits of a product, for example, a shampoo can't say it will make your hair grow back if it can't affect hair growth.;10
CPA Basics;Application;MC;When advertising a service, a supplier can't:;Lie about the prices of their services;Show their business name;Have descriptions of their services;Have customer reviews of their services;A supplier can't lie about the prices of their services when advertising their business. They also can't lie about the benefits or uses of a product.;15
CPA Basics;Seed;Y/N;Is a supplier allowed to offer rewards through a loyalty programme and plan not to give them?;No;Yes;;;According to the CPA, suppliers are not allowed to offer rewards through loyalty programmes if they don't intend to give those rewards to qualifying customers.;3
CPA Basics;Retention;MC-AOTA;Before joining a loyalty programme, which of these should you be shown?;All of the above;What the rewards are;The products and services involved;How to participate and get rewards;Documents about loyalty programmes should include a description of the programme and rewards, the names of products/services involved and instructions on how exactly to participate and get rewards.;10
CPA Basics;Retention;MC;Any documents about loyalty programmes should also include:;Contact details for the programme;The prices of products;The name of the manager;The names of the employees;Documents explaining loyalty programme should also include contact details, so that consumers can access the programme in connection with any rewards they may have earned.;10
CPA Basics;Application;MC;Which of these should you expect to see on a loyalty programme application form?;A description of the loyalty programme;The name of the manager;All the names of the employees;A list of all products the supplier sells;When you apply for a loyalty programme, the supplier/service provider should make sure that you have easy access to a full description of that loyalty programme.;15
CPA Basics;Seed;MC-AOTA;Which of the following is a supplier {{NOT}} allowed to do?;All of the above;Physically hurt a consumer;Harass a consumer;Put unfair pressure on a consumer;A supplier is not allowed to physically hurt, harass, intimidate, threaten or put unfair pressure on a consumer. ;4
CPA Basics;Retention;MC;A supplier isn't allowed to:;Be dishonest about their products and services;Ask you to pay for products and services;Help you pack your bags;Ask you to pay with cash and not card;According to the Consumer Protection Act, suppliers are not allowed to be dishonest about their products or services when advertising them or discussing them with you as a customer.;8
CPA Basics;Retention;MC;What happens if a consumer pays for a product and then the supplier runs out of stock?;The consumer must get their money back;The consumer must pay extra;The consumer can be fined;The consumer must go to another supplier;If a consumer pays for a product and then the supplier runs out of stock of that product, the supplier must refund the consumer with interest and compensate for any other resulting costs.;9
